{
  "case_id": "HHG-008",
  "case": {
    "status": "closed_fraud",
    "verdict": "fraud",
    "fraud_probability": 0.9992,
    "pattern": "card_not_present_new_device",
    "pattern_description": "",
    "affected_txn_ids": [
      "3553223",
      "3554288",
      "3554589",
      "3554683",
      "3555638",
      "3556719",
      "3557987",
      "3558054"
    ],
    "first_suspicious_txn_id": "3553223",
    "connected_card_ids": [],
    "connected_device_profiles": [],
    "exposure_usd": 353.34,
    "evidence": [
      {
        "claim": "Flagged transaction 3558054: $55.68 online (C) with model risk score 0.38; the score is an investigation input, not a verdict.",
        "source": "graph",
        "ref": "query:get_transaction_context(txn_id=3558054)",
        "entity_ids": [
          "3558054"
        ]
      },
      {
        "claim": "The bounded graph algorithm returned 1365 node(s) and 1864 observed edge(s); its scope is the returned relation set, not an unbounded global community.",
        "source": "graph",
        "ref": "mcp:graph_ring(txn_id=3558054)",
        "entity_ids": [
          "3558054"
        ]
      },
      {
        "claim": "Retrieved sponsor policy chunk '1. Actions' was ranked for this case; the deterministic R1-R10 policy engine, not retrieval score, controls actions.",
        "source": "graph",
        "ref": "mcp:policy_retrieval(chunk_id=PC-03fa4768ea71e63a5e93d19e)",
        "entity_ids": []
      },
      {
        "claim": "Retrieved sponsor policy chunk '3. Rules' was ranked for this case; the deterministic R1-R10 policy engine, not retrieval score, controls actions. Rules: R1|R10|R2|R3|R4|R5|R6|R7|R8|R9.",
        "source": "graph",
        "ref": "mcp:policy_retrieval(chunk_id=PC-52b8f607470089c2ed45765b)",
        "entity_ids": []
      },
      {
        "claim": "Retrieved sponsor policy chunk '3b. The next best action can change' was ranked for this case; the deterministic R1-R10 policy engine, not retrieval score, controls actions. Rules: R1|R2.",
        "source": "graph",
        "ref": "mcp:policy_retrieval(chunk_id=PC-ef26c3d7a59d5e9d156f8029)",
        "entity_ids": []
      },
      {
        "claim": "The bounded episode selected 8 transaction(s), totaling $353.34, from the card-window query run from 2016-10-20 22:08:56 through 2016-12-20 03:08:56.",
        "source": "graph",
        "ref": "query:get_card_window(start=2016-10-20 22:08:56, end=2016-12-20 03:08:56)",
        "entity_ids": [
          "3553223",
          "3554288",
          "3554589",
          "3554683",
          "3555638",
          "3556719",
          "3557987",
          "3558054"
        ]
      },
      {
        "claim": "The device-neighborhood query for DP-f89aeb1d49ce from 2016-12-13 03:08:56 through 2016-12-20 03:08:56 returned 86 card ID(s); device reuse alone is not treated as connected fraud.",
        "source": "graph",
        "ref": "query:get_device_neighborhood(device_id=DP-f89aeb1d49ce, start=2016-12-13 03:08:56, end=2016-12-20 03:08:56)",
        "entity_ids": [
          "DP-f89aeb1d49ce",
          "C04740-K1",
          "C02456-K1",
          "C10630-K1",
          "C00259-K1",
          "C07686-K1",
          "C05423-K1",
          "C02247-K1",
          "C11352-K1",
          "C06464-K1",
          "C04597-K2",
          "C13407-K1",
          "C09514-K1",
          "C06598-K1",
          "C00426-K2",
          "C05381-K2",
          "C04179-K1",
          "C02782-K2",
          "C06740-K1",
          "C02181-K2",
          "C08106-K1",
          "C02147-K2",
          "C08391-K2",
          "C01521-K2",
          "C11787-K1",
          "C10957-K2",
          "C03218-K2",
          "C12092-K2",
          "C13171-K2",
          "C02689-K1",
          "C06663-K2",
          "C01525-K2",
          "C05031-K2",
          "C10760-K2",
          "C13147-K1",
          "C11597-K2",
          "C09835-K1",
          "C07214-K1",
          "C01983-K1",
          "C01109-K2",
          "C10770-K1",
          "C00027-K1",
          "C02898-K1",
          "C03729-K1",
          "C11919-K2",
          "C06224-K2",
          "C08537-K1",
          "C03075-K1",
          "C04083-K1",
          "C11923-K2",
          "C06744-K2",
          "C10245-K1",
          "C12657-K1",
          "C04386-K1",
          "C11509-K2",
          "C08962-K2",
          "C02702-K2",
          "C12028-K2",
          "C03180-K1",
          "C08943-K2",
          "C02897-K1",
          "C00952-K1",
          "C09588-K1",
          "C11627-K2",
          "C04536-K2",
          "C09657-K2",
          "C10680-K1",
          "C01155-K2",
          "C04034-K2",
          "C04984-K2",
          "C10837-K2",
          "C00294-K2",
          "C05485-K1",
          "C07468-K2",
          "C07134-K2",
          "C02545-K2",
          "C05704-K2",
          "C06630-K2",
          "C12966-K1",
          "C07576-K1",
          "C12098-K1",
          "C09742-K2",
          "C03573-K1",
          "C06181-K1",
          "C11807-K1",
          "C04125-K2",
          "C07562-K2"
        ]
      },
      {
        "claim": "Retrieved 3 nearest closed case(s) for pattern memory: CC-5185, CC-2154, CC-4903.",
        "source": "graph",
        "ref": "query:find_similar_cases(pattern=card_not_present_new_device)",
        "entity_ids": [
          "CC-5185",
          "CC-2154",
          "CC-4903"
        ]
      },
      {
        "claim": "The case trigger explicitly reports that the customer did not authorize the flagged transaction; no later interview is asserted.",
        "source": "customer",
        "ref": "trigger:customer_report",
        "entity_ids": [
          "3558054"
        ]
      }
    ],
    "similar_prior_cases": [
      "CC-5185",
      "CC-2154",
      "CC-4903"
    ],
    "summary": "Alert HHG-008: the customer reported an unauthorized purchase on transaction 3558054 ($55.68, online). Investigation supports card not present new device with 8 transaction(s) in the bounded episode and $353.34 exposure. The case trigger itself explicitly reports the customer did not authorize the transaction.",
    "written_to_graph": true,
    "graph_case_id": "AG-HHG-008"
  },
  "evidence_requests": [],
  "next_best_actions": {
    "initial": [
      {
        "action": "BLOCK_CARD",
        "route": "L1",
        "reason": "R2: customer denied the transaction"
      },
      {
        "action": "CREATE_CASE",
        "route": "auto",
        "reason": "R2: open an internal case with the evidence attached"
      }
    ],
    "final": [
      {
        "action": "BLOCK_CARD",
        "route": "L1",
        "reason": "R2: customer denied the transaction"
      },
      {
        "action": "CREATE_CASE",
        "route": "auto",
        "reason": "R2: open an internal case with the evidence attached"
      }
    ],
    "what_changed": "nothing"
  },
  "sar": {
    "file": false,
    "reason": "3a: case only; exposure is not above $1,000 and no connected fraud or coordinated abuse is corroborated",
    "narrative": "",
    "subjects": [],
    "total_amount_usd": 0,
    "activity_dates": []
  },
  "stop_reason": "Probability 1.00 is beyond the policy threshold with 3 independent evidence items (policy 6).",
  "tool_calls": 8,
  "tokens": 0,
  "latency_s": 7.5311
}