{
  "case_id": "HHG-020",
  "case": {
    "status": "escalated",
    "verdict": "uncertain",
    "fraud_probability": 0.8674,
    "pattern": "none",
    "pattern_description": "",
    "affected_txn_ids": [],
    "first_suspicious_txn_id": "",
    "connected_card_ids": [],
    "connected_device_profiles": [],
    "exposure_usd": 0.0,
    "evidence": [
      {
        "claim": "Flagged transaction 3509359: $125.08 online (R) with model risk score 0.52; the score is an investigation input, not a verdict.",
        "source": "graph",
        "ref": "query:get_transaction_context(txn_id=3509359)",
        "entity_ids": [
          "3509359"
        ]
      },
      {
        "claim": "The bounded graph algorithm returned 833 node(s) and 940 observed edge(s); its scope is the returned relation set, not an unbounded global community.",
        "source": "graph",
        "ref": "mcp:graph_ring(txn_id=3509359)",
        "entity_ids": [
          "3509359"
        ]
      },
      {
        "claim": "Retrieved sponsor policy chunk '1. Actions' was ranked for this case; the deterministic R1-R10 policy engine, not retrieval score, controls actions.",
        "source": "graph",
        "ref": "mcp:policy_retrieval(chunk_id=PC-03fa4768ea71e63a5e93d19e)",
        "entity_ids": []
      },
      {
        "claim": "Retrieved sponsor policy chunk '3. Rules' was ranked for this case; the deterministic R1-R10 policy engine, not retrieval score, controls actions. Rules: R1|R10|R2|R3|R4|R5|R6|R7|R8|R9.",
        "source": "graph",
        "ref": "mcp:policy_retrieval(chunk_id=PC-52b8f607470089c2ed45765b)",
        "entity_ids": []
      },
      {
        "claim": "Retrieved sponsor policy chunk '3b. The next best action can change' was ranked for this case; the deterministic R1-R10 policy engine, not retrieval score, controls actions. Rules: R1|R2.",
        "source": "graph",
        "ref": "mcp:policy_retrieval(chunk_id=PC-ef26c3d7a59d5e9d156f8029)",
        "entity_ids": []
      },
      {
        "claim": "The bounded episode selected 1 transaction(s), totaling $125.08, from the card-window query run from 2016-10-04 06:04:26 through 2016-12-03 12:04:26.",
        "source": "graph",
        "ref": "query:get_card_window(start=2016-10-04 06:04:26, end=2016-12-03 12:04:26)",
        "entity_ids": [
          "3509359"
        ]
      },
      {
        "claim": "The device-neighborhood query for DP-d3a0af5dcc0b from 2016-11-26 12:04:26 through 2016-12-03 12:04:26 returned 17 card ID(s); device reuse alone is not treated as connected fraud.",
        "source": "graph",
        "ref": "query:get_device_neighborhood(device_id=DP-d3a0af5dcc0b, start=2016-11-26 12:04:26, end=2016-12-03 12:04:26)",
        "entity_ids": [
          "DP-d3a0af5dcc0b",
          "C00854-K2",
          "C08374-K1",
          "C12265-K2",
          "C09301-K2",
          "C05546-K1",
          "C11637-K1",
          "C02171-K1",
          "C07969-K1",
          "C01419-K1",
          "C12166-K2",
          "C03182-K1",
          "C00989-K1",
          "C06220-K1",
          "C02716-K2",
          "C10390-K1",
          "C07612-K1",
          "C12961-K2"
        ]
      }
    ],
    "similar_prior_cases": [],
    "summary": "Alert HHG-020: the model scored transaction 3509359 at 0.52 ($125.08, online). The evidence remains uncertain with fraud probability 0.87; the alert is escalated rather than treated as a confirmed fraud finding.",
    "written_to_graph": true,
    "graph_case_id": "AG-HHG-020"
  },
  "evidence_requests": [],
  "next_best_actions": {
    "initial": [
      {
        "action": "VERIFY_WITH_CUSTOMER",
        "route": "auto",
        "reason": "R1: probability 0.87 does not satisfy the high-confidence blocking rule"
      },
      {
        "action": "STEP_UP_AUTH",
        "route": "auto",
        "reason": "R1: use step-up authentication as the lower-impact alternative"
      },
      {
        "action": "CREATE_CASE",
        "route": "auto",
        "reason": "3a: open a case when probability reaches 0.30 or evidence is collected"
      }
    ],
    "final": [
      {
        "action": "VERIFY_WITH_CUSTOMER",
        "route": "auto",
        "reason": "R1: probability 0.87 does not satisfy the high-confidence blocking rule"
      },
      {
        "action": "STEP_UP_AUTH",
        "route": "auto",
        "reason": "R1: use step-up authentication as the lower-impact alternative"
      },
      {
        "action": "CREATE_CASE",
        "route": "auto",
        "reason": "3a: open a case when probability reaches 0.30 or evidence is collected"
      }
    ],
    "what_changed": "nothing"
  },
  "sar": {
    "file": false,
    "reason": "3a: no report without confirmed or strongly suspected fraud",
    "narrative": "",
    "subjects": [],
    "total_amount_usd": 0,
    "activity_dates": []
  },
  "stop_reason": "The remaining uncertainty requires a human decision or additional evidence; the probability threshold has only 1 independent evidence item(s), below the required two (policy 6).",
  "tool_calls": 9,
  "tokens": 0,
  "latency_s": 5.7031
}