{
  "case_id": "HHG-007",
  "case": {
    "status": "closed_fraud",
    "verdict": "fraud",
    "fraud_probability": 0.9599,
    "pattern": "none",
    "pattern_description": "",
    "affected_txn_ids": [
      "3514948"
    ],
    "first_suspicious_txn_id": "3514948",
    "connected_card_ids": [],
    "connected_device_profiles": [],
    "exposure_usd": 111.92,
    "evidence": [
      {
        "claim": "Flagged transaction 3514948: $111.92 in_person (W) with model risk score 0.87; the score is an investigation input, not a verdict.",
        "source": "graph",
        "ref": "query:get_transaction_context(txn_id=3514948)",
        "entity_ids": [
          "3514948"
        ]
      },
      {
        "claim": "The bounded graph algorithm returned 665 node(s) and 664 observed edge(s); its scope is the returned relation set, not an unbounded global community.",
        "source": "graph",
        "ref": "mcp:graph_ring(txn_id=3514948)",
        "entity_ids": [
          "3514948"
        ]
      },
      {
        "claim": "Retrieved sponsor policy chunk '1. Actions' was ranked for this case; the deterministic R1-R10 policy engine, not retrieval score, controls actions.",
        "source": "graph",
        "ref": "mcp:policy_retrieval(chunk_id=PC-03fa4768ea71e63a5e93d19e)",
        "entity_ids": []
      },
      {
        "claim": "Retrieved sponsor policy chunk '3. Rules' was ranked for this case; the deterministic R1-R10 policy engine, not retrieval score, controls actions. Rules: R1|R10|R2|R3|R4|R5|R6|R7|R8|R9.",
        "source": "graph",
        "ref": "mcp:policy_retrieval(chunk_id=PC-52b8f607470089c2ed45765b)",
        "entity_ids": []
      },
      {
        "claim": "Retrieved sponsor policy chunk 'Things to know' was ranked for this case; the deterministic R1-R10 policy engine, not retrieval score, controls actions.",
        "source": "graph",
        "ref": "mcp:policy_retrieval(chunk_id=PC-c72ff9e45c708e8326186f2e)",
        "entity_ids": []
      },
      {
        "claim": "The bounded episode selected 1 transaction(s), totaling $111.92, from the card-window query run from 2016-10-06 00:46:14 through 2016-12-05 03:46:14.",
        "source": "graph",
        "ref": "query:get_card_window(start=2016-10-06 00:46:14, end=2016-12-05 03:46:14)",
        "entity_ids": [
          "3514948"
        ]
      },
      {
        "claim": "Evidence request 1 recorded this explicitly simulated response: Simulated customer response: the customer states they did not authorize the in_person transaction of $111.92; the response assumption is based on the calibrated prior.",
        "source": "customer",
        "ref": "evidence_request:1",
        "entity_ids": []
      }
    ],
    "similar_prior_cases": [],
    "summary": "Alert HHG-007: the model scored transaction 3514948 at 0.87 ($111.92, in_person). Investigation supports none with 1 transaction(s) in the bounded episode and $111.92 exposure. The separately recorded customer evidence response denies the transaction.",
    "written_to_graph": true,
    "graph_case_id": "AG-HHG-007"
  },
  "evidence_requests": [
    {
      "type": "customer_validation",
      "asked_after_step": 7,
      "assumed_response": "Simulated customer response: the customer states they did not authorize the in_person transaction of $111.92; the response assumption is based on the calibrated prior."
    }
  ],
  "next_best_actions": {
    "initial": [
      {
        "action": "VERIFY_WITH_CUSTOMER",
        "route": "auto",
        "reason": "R1: probability 0.75 does not satisfy the high-confidence blocking rule"
      },
      {
        "action": "STEP_UP_AUTH",
        "route": "auto",
        "reason": "R1: use step-up authentication as the lower-impact alternative"
      },
      {
        "action": "CREATE_CASE",
        "route": "auto",
        "reason": "3a: open a case when probability reaches 0.30 or evidence is collected"
      }
    ],
    "final": [
      {
        "action": "BLOCK_CARD",
        "route": "L1",
        "reason": "R2: customer denied the transaction"
      },
      {
        "action": "CREATE_CASE",
        "route": "auto",
        "reason": "R2: open an internal case with the evidence attached"
      }
    ],
    "what_changed": "The final recommendation added BLOCK_CARD; removed STEP_UP_AUTH, VERIFY_WITH_CUSTOMER."
  },
  "sar": {
    "file": false,
    "reason": "3a: case only; exposure is not above $1,000 and no connected fraud or coordinated abuse is corroborated",
    "narrative": "",
    "subjects": [],
    "total_amount_usd": 0,
    "activity_dates": []
  },
  "stop_reason": "A recorded verification response settled the question (policy 6).",
  "tool_calls": 8,
  "tokens": 0,
  "latency_s": 6.4575
}