{
  "case_id": "HHG-018",
  "case": {
    "status": "closed_fraud",
    "verdict": "fraud",
    "fraud_probability": 0.999,
    "pattern": "none",
    "pattern_description": "",
    "affected_txn_ids": [
      "3491361"
    ],
    "first_suspicious_txn_id": "3491361",
    "connected_card_ids": [],
    "connected_device_profiles": [],
    "exposure_usd": 39.08,
    "evidence": [
      {
        "claim": "Flagged transaction 3491361: $39.08 in_person (W) with model risk score 0.48; the score is an investigation input, not a verdict.",
        "source": "graph",
        "ref": "query:get_transaction_context(txn_id=3491361)",
        "entity_ids": [
          "3491361"
        ]
      },
      {
        "claim": "The bounded graph algorithm returned 805 node(s) and 804 observed edge(s); its scope is the returned relation set, not an unbounded global community.",
        "source": "graph",
        "ref": "mcp:graph_ring(txn_id=3491361)",
        "entity_ids": [
          "3491361"
        ]
      },
      {
        "claim": "Retrieved sponsor policy chunk '1. Actions' was ranked for this case; the deterministic R1-R10 policy engine, not retrieval score, controls actions.",
        "source": "graph",
        "ref": "mcp:policy_retrieval(chunk_id=PC-03fa4768ea71e63a5e93d19e)",
        "entity_ids": []
      },
      {
        "claim": "Retrieved sponsor policy chunk '3. Rules' was ranked for this case; the deterministic R1-R10 policy engine, not retrieval score, controls actions. Rules: R1|R10|R2|R3|R4|R5|R6|R7|R8|R9.",
        "source": "graph",
        "ref": "mcp:policy_retrieval(chunk_id=PC-52b8f607470089c2ed45765b)",
        "entity_ids": []
      },
      {
        "claim": "Retrieved sponsor policy chunk 'Pattern 3: Card-not-present fraud from a new device.' was ranked for this case; the deterministic R1-R10 policy engine, not retrieval score, controls actions.",
        "source": "graph",
        "ref": "mcp:policy_retrieval(chunk_id=PC-338faa423d37c6394ea3039a)",
        "entity_ids": []
      },
      {
        "claim": "The bounded episode selected 1 transaction(s), totaling $39.08, from the card-window query run from 2016-09-28 13:41:26 through 2016-11-27 14:41:26.",
        "source": "graph",
        "ref": "query:get_card_window(start=2016-09-28 13:41:26, end=2016-11-27 14:41:26)",
        "entity_ids": [
          "3491361"
        ]
      },
      {
        "claim": "The case trigger explicitly reports that the customer did not authorize the flagged transaction; no later interview is asserted.",
        "source": "customer",
        "ref": "trigger:customer_report",
        "entity_ids": [
          "3491361"
        ]
      }
    ],
    "similar_prior_cases": [],
    "summary": "Alert HHG-018: the customer reported an unauthorized purchase on transaction 3491361 ($39.08, in_person). Investigation supports none with 1 transaction(s) in the bounded episode and $39.08 exposure. The case trigger itself explicitly reports the customer did not authorize the transaction.",
    "written_to_graph": true,
    "graph_case_id": "AG-HHG-018"
  },
  "evidence_requests": [],
  "next_best_actions": {
    "initial": [
      {
        "action": "BLOCK_CARD",
        "route": "L1",
        "reason": "R2: customer denied the transaction"
      },
      {
        "action": "CREATE_CASE",
        "route": "auto",
        "reason": "R2: open an internal case with the evidence attached"
      }
    ],
    "final": [
      {
        "action": "BLOCK_CARD",
        "route": "L1",
        "reason": "R2: customer denied the transaction"
      },
      {
        "action": "CREATE_CASE",
        "route": "auto",
        "reason": "R2: open an internal case with the evidence attached"
      }
    ],
    "what_changed": "nothing"
  },
  "sar": {
    "file": false,
    "reason": "3a: case only; exposure is not above $1,000 and no connected fraud or coordinated abuse is corroborated",
    "narrative": "",
    "subjects": [],
    "total_amount_usd": 0,
    "activity_dates": []
  },
  "stop_reason": "Probability 1.00 is beyond the policy threshold with 2 independent evidence items (policy 6).",
  "tool_calls": 8,
  "tokens": 0,
  "latency_s": 7.5448
}